{
  "$schema": "https://json-schema.org/draft/2020-12/schema",
  "title": "Lucid configuration",
  "description": "Representation of the command line arguments for pylucid expressed in a configuration file",
  "type": "object",
  "$defs": {
    "matrix": {
      "type": "array",
      "items": {
        "type": "array",
        "items": {
          "type": "number"
        }
      }
    },
    "set_type": {
      "oneOf": [
        {
          "type": "string"
        },
        {
          "type": "array",
          "minItems": 1,
          "items": {
            "oneOf": [
              {
                "type": "string"
              },
              {
                "type": "object",
                "additionalProperties": false,
                "required": ["RectSet"],
                "properties": {
                  "RectSet": {
                    "$ref": "#/$defs/rect_set"
                  }
                }
              },
              {
                "type": "object",
                "additionalProperties": false,
                "required": ["SphereSet"],
                "properties": {
                  "SphereSet": {
                    "$ref": "#/$defs/sphere_set"
                  }
                }
              },
              {
                "type": "object",
                "additionalProperties": false,
                "required": ["EllipseSet"],
                "properties": {
                  "EllipseSet": {
                    "$ref": "#/$defs/ellipse_set"
                  }
                }
              }
            ]
          }
        }
      ]
    },
    "sphere_set": {
      "type": "object",
      "required": ["center", "radius"],
      "additionalProperties": false,
      "properties": {
        "center": {
          "description": "Center of the sphere in each dimension.",
          "type": "array",
          "minItems": 1,
          "items": {
            "type": "number"
          }
        },
        "radius": {
          "description": "Radius of the sphere.",
          "type": "number"
        }
      }
    },
    "ellipse_set": {
      "type": "object",
      "required": ["center", "radii"],
      "additionalProperties": false,
      "properties": {
        "center": {
          "description": "Center of the sphere in each dimension.",
          "type": "array",
          "minItems": 1,
          "items": {
            "type": "number"
          }
        },
        "radii": {
          "description": "Semi-axis lengths of the ellipse in each dimension.",
          "type": "array",
          "minItems": 1,
          "items": {
            "type": "number"
          }
        }
      }
    },
    "rect_set": {
      "description": "A set of rectangles, each defined by a lower and upper bound for each dimension.",
      "oneOf": [
        {
          "type": "array",
          "minItems": 1,
          "items": {
            "type": "array",
            "minItems": 2,
            "maxItems": 2,
            "items": {
              "type": "number"
            }
          }
        },
        {
          "type": "object",
          "required": ["lower", "upper"],
          "additionalProperties": false,
          "properties": {
            "lower": {
              "description": "Lower bounds for each dimension.",
              "type": "array",
              "minItems": 1,
              "items": {
                "type": "number"
              }
            },
            "upper": {
              "description": "Upper bounds for each dimension.",
              "type": "array",
              "minItems": 1,
              "items": {
                "type": "number"
              }
            }
          }
        }
      ]
    }
  },
  "properties": {
    "$schema": {
      "description": "The path or URL to the JSON schema describing this file.",
      "type": "string",
      "format": "uri"
    },
    "verbose": {
      "description": "Verbosity level of the output.",
      "type": "integer",
      "minimum": -1,
      "maximum": 5,
      "default": 3
    },
    "seed": {
      "description": "Seed for the random number generator.",
      "type": "integer",
      "default": -1
    },
    "x_samples": {
      "description": "Samples from the state space.",
      "$ref": "#/$defs/matrix"
    },
    "xp_samples": {
      "description": "Transition samples from the state space.",
      "$ref": "#/$defs/matrix"
    },
    "system_dynamics": {
      "description": "Dynamics of the system, describing how it evolves over time.",
      "type": "array",
      "items": {
        "type": "string"
      }
    },
    "X_bounds": {
      "description": "Bounds for the state space.",
      "$ref": "#/$defs/set_type"
    },
    "X_init": {
      "description": "Initial state of the system.",
      "$ref": "#/$defs/set_type"
    },
    "X_unsafe": {
      "description": "Unsafe states of the system.",
      "$ref": "#/$defs/set_type"
    },
    "epsilon": {
      "description": "Radius of the barrier certificate.",
      "type": "number",
      "default": 0.0
    },
    "b_kappa": {
      "description": "Coefficient.",
      "type": "number",
      "default": 1.0
    },
    "set_scaling": {
      "description": "Scaling factor for sets in the periodic space.",
      "type": "number",
      "default": 0.01
    },
    "b_norm": {
      "description": "Norm of the barrier function.",
      "type": "number",
      "default": 1.0
    },
    "gamma": {
      "type": "number"
    },
    "C_coeff": {
      "type": "number"
    },
    "lambda": {
      "type": "number"
    },
    "num_samples": {
      "description": "Number of samples to use to fit the estimator.",
      "type": "integer",
      "minimum": 1,
      "default": 1000
    },
    "time_horizon": {
      "description": "Time horizon to consider in the specification.",
      "type": "integer",
      "minimum": 1,
      "default": 5
    },
    "sigma_f": {
      "type": "number"
    },
    "sigma_l": {
      "description": "Length scale for the estimator, can be a single value or a list.",
      "oneOf": [
        {
          "type": "number"
        },
        {
          "type": "array",
          "items": {
            "type": "number"
          }
        }
      ]
    },
    "feature_sigma_l": {
      "description": "Length scale for the feature map, can be a single value or a list.",
      "oneOf": [
        {
          "type": "number"
        },
        {
          "type": "array",
          "items": {
            "type": "number"
          }
        }
      ]
    },
    "num_frequencies": {
      "description": "Number of frequencies to use in the feature map.",
      "type": "integer",
      "minimum": 1,
      "default": 4
    },
    "oversample_factor": {
      "description": "Factor by which to oversample the feature map.",
      "type": "number",
      "minimum": 1,
      "default": 2
    },
    "lattice_resolution": {
      "description": "Number of points of the lattice in each dimension. Must be greater than the Nyquist frequency. If negative, oversample_factor will be used instead.",
      "type": "integer",
      "minimum": -1,
      "default": -1
    },
    "noise_scale": {
      "description": "Scale of the noise to add to the system dynamics.",
      "type": "number",
      "minimum": 0,
      "default": 0.01
    },
    "plot": {
      "description": "Whether to plot the results.",
      "type": "boolean"
    },
    "verify": {
      "description": "Whether to verify the results.",
      "type": "boolean"
    },
    "print_stats": {
      "description": "Whether to print detailed statistics about the run.",
      "type": "boolean"
    },
    "problem_log_file": {
      "description": "File to log the problem formulation.",
      "type": "string",
      "default": "problem.lp"
    },
    "iis_log_file": {
      "description": "File to log the irreducible infeasible set (IIS).",
      "type": "string",
      "default": "iis.ilp"
    },
    "estimator": {
      "description": "Type of estimator to use.",
      "type": "string",
      "enum": ["KernelRidgeRegressor", "ModelEstimator"],
      "default": "KernelRidgeRegressor"
    },
    "kernel": {
      "description": "Type of kernel to use for the estimator.",
      "type": "string",
      "enum": ["GaussianKernel"],
      "default": "GaussianKernel"
    },
    "feature_map": {
      "description": "Type of feature map to use for the estimator.",
      "type": "string",
      "enum": [
        "LinearTruncatedFourierFeatureMap",
        "ConstantTruncatedFourierFeatureMap",
        "LogTruncatedFourierFeatureMap"
      ],
      "default": "LinearTruncatedFourierFeatureMap"
    },
    "optimiser": {
      "description": "Type of optimiser to use for the estimator.",
      "type": "string",
      "enum": [
        "GurobiOptimiser",
        "AlglibOptimiser",
        "HighsOptimiser",
        "SoplexOptimiser"
      ],
      "default": "GurobiOptimiser"
    }
  }
}
