{
  "seed": 42,
  "X_bounds": "RectSet([-1], [1])",
  "X_init": "RectSet([-0.5], [0.5])",
  "X_unsafe": ["RectSet([-1], [-0.9])", "RectSet([0.9], [1])"],
  "x_samples": [[1], [-1]],
  "xp_samples": [[0.5], [-0.5]],
  "lambda": 0.00001,
  "time_horizon": 15,
  "sigma_f": 18,
  "sigma_l": 0.034,
  "num_frequencies": 5,
  "oversample_factor": 64
}
